<?xml version="1.0" encoding="UTF-8"?>
<!DOCTYPE mapper PUBLIC "-//mybatis.org//DTD Mapper 3.0//EN" "http://mybatis.org/dtd/mybatis-3-mapper.dtd">
<mapper namespace="cn.sliew.rtomde.executor.mapper.SysUserMapper">

    <parameterMap id="BaseParamMap" type="cn.sliew.rtomde.executor.entity.SysUserParam">
        <parameter property="id" javaType="long"/>
    </parameterMap>
    <resultMap id="BaseResultMap" type="cn.sliew.rtomde.executor.entity.SysUserDTO">
        <id column="id" property="id"/>
        <result column="username" property="username"/>
        <result column="password" property="password"/>
        <result column="nickname" property="nickname"/>
        <result column="email" property="email"/>
        <result column="phone" property="phone"/>
        <result column="deleted" property="deleted"/>
        <result column="create_time" property="createTime"/>
        <result column="creator" property="creator"/>
        <result column="update_time" property="updateTime"/>
        <result column="updater" property="updater"/>
        <result column="comments" property="comments"/>
    </resultMap>

    <resultMap id="BaseDetailResultMap" type="map">
        <id column="id" property="id"/>
        <result column="username" property="username"/>
        <result column="password" property="password"/>
        <result column="nickname" property="nickname"/>
        <result column="email" property="email"/>
        <result column="phone" property="phone"/>
        <result column="deleted" property="deleted"/>
        <result column="create_time" property="createTime"/>
        <result column="creator" property="creator"/>
        <result column="update_time" property="updateTime"/>
        <result column="updater" property="updater"/>
        <result column="comments" property="comments"/>
    </resultMap>


    <sql id="Base_Column_List">
        id, username, `password`, nickname, email, phone, deleted, create_time, creator,
        update_time, updater, comments
    </sql>
    <select id="selectByPrimaryKey" parameterMap="BaseParamMap" resultMap="BaseResultMap">
        select <include refid="Base_Column_List"/>
        from sys_user
        where id = #{id}
    </select>
</mapper>